{
  "$schema": "https://json-schema.org/draft/2020-12/schema",
  "title": "agpeya/prime_hour.json",
  "type": "array",
  "items": {
    "type": "object",
    "properties": {
      "english_title": {
        "type": "string"
      },
      "coptic_title": {
        "type": "null"
      },
      "arabic_title": {
        "anyOf": [
          {
            "type": "null"
          },
          {
            "type": "string"
          }
        ]
      },
      "title": {
        "type": "string"
      },
      "tbodies": {
        "type": "array",
        "items": {
          "type": "object",
          "properties": {
            "rows": {
              "type": "array",
              "items": {
                "type": "object",
                "properties": {
                  "row-class": {
                    "type": "string"
                  },
                  "cells": {
                    "type": "array",
                    "items": {
                      "type": "object",
                      "properties": {
                        "english": {
                          "type": "string"
                        },
                        "arabic": {
                          "type": "string"
                        }
                      },
                      "required": [
                        "english"
                      ],
                      "additionalProperties": true
                    }
                  }
                },
                "required": [
                  "cells",
                  "row-class"
                ],
                "additionalProperties": true
              }
            }
          },
          "required": [
            "rows"
          ],
          "additionalProperties": true
        }
      },
      "repeated_prayer_title": {
        "type": "string"
      },
      "source": {
        "type": "string"
      },
      "category": {
        "type": "string"
      }
    },
    "required": [],
    "additionalProperties": true
  }
}
