[
  {
    "english_title": "Prayer for God’s Guidance",
    "coptic_title": null,
    "arabic_title": "صلاة لطلب مشورة الله قبل الشروع في عمل",
    "title": "Prayer for God’s Guidance",
    "tbodies": [
      {
        "rows": [
          {
            "row-class": "text",
            "cells": [
              {
                "english": "Lord, You are aware that I do not know what is good for me, and now that I am about to start (...), how can I know if it is right unless You guide me with Your grace? O Lord, I beseech Your guidance in this matter. Do not let me follow my tendencies, if it will cause me to be confused and fall. Keep me from slipping, help me, and let it be according to Your will. If You see it fit, grant me Your blessing to complete it. If not, remove this desire from my heart. You know all things, nothing is concealed from You, Lord I am Your servant, deal with me as You see fit, as I realize that I will have neither success nor peace unless I submit myself to Your will. Teach me to say in every occasion, “Let it be according to Your will, Lord, not according to my own.” For Yours is the kingdom, the power, the glory forever and ever. Amen.",
                "arabic": "إلهي، أنت تَعْلَمُ أني لا أعرف ما هو الصالح لنفسي. وها أنا قد شرعت في ..... فمن أين لي أن أعرف حسناً ما هو الصالح لي إن لم أسترشد نعمتك في ذلك؟ فأسألك يارب أن تدبرني في هذا الأمر. ولا تتركني ومشورة نفسي، ولا تدعني أجري وراء ميولي لئلا أتورط وأسقط، بل اعصم عبدك من الزلل، وكن متكَّلِي وعوني، ودبر الأمر بحسب إرادتك كما يوافق صلاحك. وإن حسُن لديك فليكن كما تريد، وهبني نعمتك لأتممه. وإن كان يضرُ فانزع مني يارب هذه الرغبة، لأنك عليمٌ بكل شىء، ولا يخفى عليك أمر. وها أنا عبدك، عاملني بما يوافقك، إذ لا نجاح تام، ولا سلام كامل، إلا بتسليم ذاتي تحت تدبير مشيئتك. وعلمني أن أقول فى كل شىء: يا أبتاه، ليس كمشيئتي بل كمشيئتك. لأن لك الملك والقوة والمجد من الآن وإلى الأبد، آمين."
              }
            ]
          }
        ]
      }
    ]
  },
  {
    "english_title": "Prayer for God’s Accompaniment",
    "coptic_title": null,
    "arabic_title": null,
    "title": "Prayer for God’s Accompaniment",
    "tbodies": [
      {
        "rows": [
          {
            "row-class": "text",
            "cells": [
              {
                "english": "Grant me Your grace O Lord Jesus, the longsuffering, and be with me that I may dwell in You unto the end. Grant me that I may ask and wish always for what is pleasing to You. Let Your will be my will. Let my will follow always Your will and be in accord with it in a perfect way. Let both of us have one will, for I don’t want to desire anything except what You want and what You wish."
              }
            ]
          },
          {
            "row-class": "text",
            "cells": [
              {
                "english": "Grant me not to lust for the things of this world, that I may dwell in You in all things and hold above all things the desire to be as You would have me be and to do as You would have me do. You are the peace of my heart and the shelter of my life. You are the real peace and the only comfort and apart from You everything is hard and confusing. Therefore, in this peace which is in You, the Great Eternal Good, I am able to rest. For Yours is the kingdom, and the power and the glory forever."
              }
            ]
          }
        ]
      }
    ]
  }
]
