[
  {
    "english_title": "Psalm Response",
    "coptic_title": "",
    "arabic_title": "مرد المزمور",
    "tbodies": [
      {
        "rows": [
          {
            "row-class": "text",
            "seasons": [
              "Joyful 29th of the Month"
            ],
            "cells": [
              {
                "english": "Alleluia. Alleluia. Jesus Christ the Son of God was incarnate of the Virgin, was born of the Virgin in Bethlehem of Judea, rose from the dead on the third day. Alleluia. Alleluia.",
                "coptic": "Ⲁⲗ̅ ⲁ̅ⲗ̅ : Ⲓⲏ̅ⲥ̅ Ⲡⲭ̅ⲥ̅ ⲡ̀ϣⲏⲣⲓ ⲙ̀Ⲫϯ : ⲁϥϭⲓⲥⲁⲣⲝ ⲉ̀ⲃⲟⲗ ϧⲉⲛ ϯⲡⲁⲣⲑⲉⲛⲟⲥ ⲟⲩⲟϩ ⲁⲩⲙⲁⲥϥ ϧⲉⲛ Ⲃⲏⲉⲑⲗⲉⲉⲙ ⲕⲁⲧⲁ ⲛⲓⲥ̀ⲙⲏ ⲙ̀ⲡ̀ⲣⲟⲫⲏⲧⲓⲕⲟⲛ : ⲁϥⲧⲱⲛϥ ⲉ̀ⲃⲟⲗϧⲉⲛ ⲛⲏⲉⲑⲙⲱⲟⲩⲧ ϧⲉⲛ ⲡⲓⲉ̀ϩⲟⲟⲩ ⲙ̀ⲙⲁϩ ϣⲟⲙⲧ : ⲁ̅ⲗ̅ ⲁ̅ⲗ̅",
                "arabic": "هلليلويا هلليلويا، يسوع المسيح إبن الله تجسد من العذراء، وُلد من العذراء في بيت لحم اليهودية، وقام من بين الأموات في اليوم الثالث. هلليلويا هلليلويا."
              }
            ]
          },
          {
            "row-class": "text",
            "seasons": [
              "Feast of the Annunciation"
            ],
            "cells": [
              {
                "english": "Alleluia alleluia, Jesus Christ the Son of God, was incarnate from the Virgin.",
                "coptic": "Ⲁⲗⲗⲏⲗⲟⲩⲓⲁ ⲁ̅ⲗ̅: Ⲓⲏⲥⲟⲩⲥ Ⲡⲓⲭ̀ⲣⲓⲥⲧⲟⲥ Ⲡ̀ϣⲏⲣⲓ ⲙ̀Ⲫ̀ⲛⲟⲩϯ: ⲁϥϭⲓⲥⲁⲣⲝ ⲉ̀ⲃⲟⲗ ϧⲉⲛ Ϯⲡⲁⲣⲑⲉⲛⲟⲥ",
                "arabic": "هلليلويا هلليلويا، يسوع المسيح إبن الله، تجسد من العذراء،"
              }
            ]
          },
          {
            "row-class": "text",
            "seasons": [
              "Feast of the Nativity"
            ],
            "cells": [
              {
                "english": "Alleluia, Alleluia. Jesus Christ the Son of God was born of the Virgin in Bethlehem of Judea according to the prophetic sayings. Alleluia, Alleluia.",
                "coptic": "Ⲁⲗⲗⲏⲗⲟⲩⲓⲁ ⲁ̅ⲗ̅: Ⲓⲏ̅ⲥ̅ Ⲡⲭ̅ⲥ̅ ⲡ̀Ϣⲏⲣⲓ ⲙ̀Ⲫϯ ⲁⲥⲙⲁⲥϥ ⲛ̀ϫⲉ ϯⲠⲁⲣⲑⲉⲛⲟⲥ ϧⲉⲛ Ⲃⲏⲑⲗⲉⲉⲙ ⲛ̀ⲧⲉ ϯⲒⲟⲩⲇⲉⲁ̀ ⲕⲁⲧⲁ ⲛⲓⲥ̀ⲙⲏ ⲙ̀ⲡ̀ⲣⲟⲩⲫⲏⲧⲓⲕⲟⲛ. Ⲁⲗⲗⲏⲗⲟⲩⲓⲁ ⲁ̅ⲗ̅.",
                "arabic": "هلليلويا هلليلويا. يسوع المسيح ابن الله ولدته العذراء في بيت لحم اليهودية كالأصوات النبوي. هلليلويا هلليلويا."
              }
            ]
          },
          {
            "row-class": "text",
            "seasons": [
              "Feast of the Theophany"
            ],
            "cells": [
              {
                "english": "Alleluia alleluia, Jesus Christ the Son of God was baptized in the Jordan, alleluia alleluia.",
                "coptic": "Ⲁⲗⲗⲏⲗⲟⲩⲓⲁ ⲁ̅ⲗ̅: Ⲓⲏⲥⲟⲩⲥ Ⲡⲓⲭ̀ⲣⲓⲥⲧⲟⲥ Ⲡ̀ϣⲏⲣⲓ ⲙ̀Ⲫ̀ⲛⲟⲩϯ ⲁϥϭⲓⲱⲙⲥ ϧⲉⲛ Ⲡⲓⲓⲟⲣⲇⲁⲛⲏⲥ: ⲁⲗⲗⲏⲗⲟⲩⲓⲁ ⲁ̅ⲗ̅.",
                "arabic": "هلليلويا هلليلويا، يسوع المسيح إبن الله إعتمد في الأردن، هلليلويا هلليلويا."
              }
            ]
          },
          {
            "row-class": "text",
            "seasons": [
              "Hosanna Sunday"
            ],
            "cells": [
              {
                "english": "Alleluia alleluia. Jesus Christ the Son of God, entered into Jerusalem. Alleluia alleluia.",
                "coptic": "Ⲁⲗⲗⲏⲗⲟⲩⲓⲁ ⲁ̅ⲗ̅. Ⲓⲏⲥⲟⲩⲥ Ⲡⲓⲭ̀ⲣⲓⲥⲧⲟⲥ Ⲡ̀ϣⲏⲣⲓ ⲙ̀Ⲫ̀ⲛⲟⲩϯ: ⲁϥϣⲉ ⲉ̀ϧⲟⲩⲛ ⲉ̀Ⲓⲉⲣⲟⲩⲥⲁⲗⲏⲙ: ⲁ̅ⲗ̅ ⲁ̅ⲗ̅.",
                "arabic": "هلليلويا هلليلويا، يسوع المسيح إبن الله، دخل أورُشَليم، هلليلويا هلليلويا."
              }
            ]
          },
          {
            "row-class": "text",
            "seasons": [
              "Feast of the Resurrection",
              "Holy 50 Days - Before Ascension"
            ],
            "cells": [
              {
                "english": "Alleluia, alleluia. Jesus Christ the King of glory, has risen from the dead on the third day. Alleluia, alleluia.",
                "coptic": "Ⲁⲗⲗⲉⲗⲟⲩⲓⲁ ⲁ̅ⲗ̅. Ⲓⲏⲥⲟⲩⲥ Ⲡⲓⲭ̀ⲣⲓⲥⲧⲟⲥ Ⲡ̀ⲟⲩⲣⲟ ⲛ̀ⲧⲉ ⲡ̀ⲱ̀ⲟⲩ: ⲁϥⲧⲱⲛϥ ⲉ̀ⲃⲟⲗ ϧⲉⲛ ⲛⲏⲉⲑⲙⲱⲟⲩⲧ ϧⲉⲛ ⲡⲓⲉ̀ϩⲟⲟⲩ ⲙ̀ⲙⲁϩϣⲟⲙⲧ. Ⲁ̅ⲗ̅ ⲁ̅ⲗ̅.",
                "arabic": "هلليلويا هلليلويا. يسوع المسيح ملك المجد، قام من بين الأموات في اليوم الثالث. هلليلويا هلليلويا."
              }
            ]
          },
          {
            "row-class": "text",
            "seasons": [
              "Feast of the Ascension",
              "Holy 50 Days - After Ascension"
            ],
            "cells": [
              {
                "english": "Alleluia, alleluia. Christ has risen from the dead, ascended into the heavens, and is seated at the right hand of His Father. Alleluia, alleluia.",
                "coptic": "Ⲁⲗⲗⲏⲗⲟⲩⲓⲁ ⲁ̅ⲗ̅. Ⲡⲓⲭ̀ⲣⲓⲥⲧⲟⲥ ⲁϥⲧⲱⲛϥ ⲉ̀ⲃⲟⲗ ϧⲉⲛ ⲛⲏⲉⲑⲙⲱⲟⲩⲧ: ⲟⲩⲟϩ ⲁϥϣⲉⲛⲁϥ ⲉ̀ⲡ̀ϣⲱⲓ ⲉ̀ⲛⲓⲫⲏⲟⲩⲓ̀: ⲁϥϩⲉⲙⲥⲓ ⲥⲁⲟⲩⲓ̀ⲛⲁⲙ ⲙ̀Ⲡⲉϥⲓⲱⲧ. Ⲁ̅ⲗ̅ ⲁ̅ⲗ̅.",
                "arabic": "هلليلويا هلليلويا. المسيح قام من بين الأموات، وصعد إلى السموات، وجلس عن يمين أبيه. هلليلويا هلليلويا.<br/>"
              }
            ]
          },
          {
            "row-class": "text",
            "season": "Feast of Pentecost",
            "cells": [
              {
                "english": "Alleluia, alleluia. Christ has risen and ascended, and sent us the Paraclete, the Spirit of Truth. Alleluia, alleluia.",
                "coptic": "Ⲁⲗⲗⲏⲗⲟⲩⲓⲁ ⲁ̅ⲗ̅. Ⲡⲓⲭ̀ⲣⲓⲥⲧⲟⲥ ⲁϥⲧⲱⲛϥ ⲟⲩⲟϩ ⲁϥϣⲉⲛⲁϥ: ⲁϥⲟⲩⲱⲣⲡ ⲛⲁⲛ ⲙ̀Ⲡⲓⲡⲁⲣⲁⲕⲗⲏⲧⲟⲛ: Ⲡⲓⲡ̀ⲛⲉⲩⲙⲁ ⲛ̀ⲧⲉ ϯⲙⲉⲑⲙⲏⲓ. Ⲁ̅ⲗ̅ ⲁ̅ⲗ̅.",
                "arabic": "هلليلويا هلليلويا. المسيح قام ثم صعد، وأرسل لنا البارقليط، روح الحق. هلليلويا هلليلويا."
              }
            ]
          },
          {
            "row-class": "text",
            "seasons": [
              "Feast of the Circumcision"
            ],
            "cells": [
              {
                "english": "Alleluia Alleluia Jesus Christ, the Son of God, accepted unto Himself circumcision as mentioned in the Law. Alleluia Alleluia.<br/>",
                "coptic": "Ⲁⲗⲗⲏⲗⲟⲩⲓⲁ ⲁ̅ⲗ̅ Ⲓⲏ̅ⲥ̅ Ⲡⲭ̅ⲥ̅ ⲡ̀Ϣⲏⲣⲓ ⲙ̀Ⲫ̀ϯ: ⲁϥϣⲱⲟⲡ ⲉ̀ⲣⲟϥ ⲙ̀ⲡⲓⲥⲉⲃⲓ ⲕⲁⲧⲁ ⲡⲉⲧⲉⲥϣⲉ ϧⲉⲛ ⲡⲓⲛⲟⲙⲟⲥ. Ⲁ̅ⲗ̅ ⲁ̅ⲗ̅.<br/>",
                "arabic": "هلليلويا هلليلويا يسو ع المسيح ابن الله قبل إليه الختان كما ينبغي بالناموس. هلليلويا هلليلويا."
              }
            ]
          },
          {
            "row-class": "text",
            "seasons": [
              "Presentation of the Lord Christ in the Temple"
            ],
            "cells": [
              {
                "english": "Alleluia Alleluia Jesus Christ, the Son of God, entered into the temple. Alleluia Alleluia.",
                "coptic": "Ⲁⲗⲗⲏⲗⲟⲩⲓⲁ ⲁ̅ⲗ̅ Ⲓⲏ̅ⲥ̅ Ⲡⲭ̅ⲥ̅ ⲡ̀Ϣⲏⲣⲓ ⲙ̀Ⲫ̀ϯ: ⲁϥϣⲉ ⲉ̀ϧⲟⲩⲛ ⲉ̀ⲡⲓⲉⲣⲫⲉⲓ. Ⲁ̅ⲗ̅ ⲁ̅ⲗ̅.<br/>",
                "arabic": "هلليلويا هلليلويا يسوع المسيح ابن الله دخل الى الهيكل. هلليلويا هلليلويا."
              }
            ]
          },
          {
            "row-class": "text",
            "seasons": [
              "Entrance of the Lord Christ into the Land of Egypt"
            ],
            "cells": [
              {
                "english": "Alleluia (2), Jesus Christ the Son of God, came to the land of Egypt, alleluia (2). <br/>",
                "coptic": "Ⲁ̅ⲗ̅ ⲁ̅ⲗ̅: Ⲓⲏⲥⲟⲩⲥ Ⲡⲓⲭ̀ⲣⲓⲥⲧⲟⲥ Ⲡ̀ϣⲏⲣⲓ ⲙ̀Ⲫ̀ⲛⲟⲩϯ: ⲁϥⲓ̀ ⲉ̀ϧⲟⲩⲛ ⲉ̀ⲡ̀ⲕⲁϩⲓ ⲛ̀Ⲭⲏⲙⲓ: ⲁⲗ̅ ⲁ̅ⲗ̅.",
                "arabic": "هلليلويا (2)، يسوع المسيح إبن الله، دخل إلي أرض مصر، هلليلويا (2)."
              }
            ]
          },
          {
            "row-class": "text",
            "seasons": [
              "Feast of the Wedding at Cana of Galilee"
            ],
            "cells": [
              {
                "english": "Alleluia, alleluia, Jesus Christ, the Son of God, blessed the water and changed it into wine. Alleluia, alleluia.",
                "coptic": "Ⲁⲗⲗⲏⲗⲟⲩⲓⲁⲗ ⲁ̅ⲗ̅: Ⲓⲏ̅ⲥ̅ Ⲡⲭ̅ⲥ̅ Ⲡ̀ϣⲏⲣⲓ ⲙ̀Ⲫϯ: ⲁϥⲥ̀ⲙⲟⲩ ⲉ̀ⲛⲓⲙⲱⲟⲩ ⲁϥⲁⲓⲧⲟⲩ ⲛ̀ⲏⲣⲡ: ⲁ̅ⲗ̅ ⲁ̅ⲗ̅.",
                "arabic": "هلليلويا هلليلويا يسوع المسيح ابن الله بارك المياه فصيرها خمراً. هلليلويا هلليلويا.<br/>"
              }
            ]
          },
          {
            "row-class": "text",
            "seasons": [
              "Feast of the Transfiguration"
            ],
            "cells": [
              {
                "english": "Alleluia Alleluia, Jesus Christ the Son of God, was transfigured upon Mount Tabor, Alleluia Alleluia.",
                "coptic": "Ⲁⲗⲗⲏⲗⲟⲩⲓⲁ ⲁ̅ⲗ̅: Ⲓⲏ̅ⲥ̅ Ⲡⲭ̅ⲥ̅ ⲡ̀Ϣⲏⲣⲓ ⲙ̀Ⲫ̀ϯ: ⲁϥϣⲱⲃⲧ ⲉ̀ϫⲉⲛ ⲡⲓⲧⲱⲟⲩ ⲛ̀Ⲑⲁⲃⲱⲣ: ⲁⲗⲗⲏⲗⲟⲩⲓⲁ ⲁ̅ⲗ̅.",
                "arabic": "هلليلويا هلليلويا، يسوع المسيح إبن الله، تجلى على جبل تابور، هلليلويا هلليلويا."
              }
            ]
          },
          {
            "row-class": "text",
            "seasons": [
              "Nayrouz (Coptic New Year)"
            ],
            "cells": [
              {
                "english": "Alleluia alleluia, bless the crown of the year, with Your goodness O Lord, the rivers and the fountains, the plants and the fruits, alleluia alleluia.",
                "coptic": "Ⲁⲗⲗⲏⲗⲟⲩⲓⲁ ⲁ̅ⲗ̅: ⲥ̀ⲙⲟⲩ ⲉ̀ⲡⲓⲭ̀ⲗⲟⲙ ⲛ̀ⲧⲉ ϯⲣⲟⲙⲡⲓ: ϩⲓⲧⲉⲛ ⲧⲉⲕⲙⲉⲧⲭ̀ⲣⲏⲥⲧⲟⲥ Ⲡ̀ϭⲟⲓⲥ: ⲛⲓⲓⲁⲣⲱⲟⲩ ⲛⲉⲙ ⲛⲓⲙⲟⲩⲙⲓ: ⲛⲉⲙ ⲛⲓⲥⲓϯ ⲛⲉⲙ ⲛⲓⲕⲁⲣⲡⲟⲥ: ⲁⲗⲗⲏⲗⲟⲩⲓⲁ ⲁ̅ⲗ̅.",
                "arabic": "هلليلويا هلليلويا، بارك إكليل [هذه] السنة، بصلاحك يا رب، الأنهار والينابيع، والزروع والأثمار، هلليلويا هلليلويا."
              }
            ]
          },
          {
            "row-class": "text",
            "seasons": [
              "Feast of the Cross"
            ],
            "cells": [
              {
                "english": "Alleluia alleluia, Jesus Christ the Son of God, who was crucified on the Cross, destroy Satan under our feet, alleluia alleluia.",
                "coptic": "Ⲁⲗⲗⲏⲗⲟⲩⲓⲁ ⲁ̅ⲗ̅: Ⲓⲏⲥⲟⲩⲥ Ⲡⲓⲭ̀ⲣⲓⲥⲧⲟⲥ Ⲡ̀ϣⲏⲣⲓ ⲙ̀Ⲫ̀ⲛⲟⲩϯ: ⲫⲏⲉ̀ⲧⲁⲩⲁϣϥ ⲉ̀Ⲡⲓⲥ̀ⲧⲁⲩⲣⲟⲥ: ⲉⲕⲉ̀ϧⲟⲙϧⲉⲙ ⲙ̀Ⲡ̀ⲥⲁⲧⲁⲛⲁⲥ ⲥⲁⲡⲉⲥⲏⲧ ⲛ̀ⲛⲉⲛϭⲁⲗⲁⲩϫ: ⲁ̅ⲗ̅ ⲁ̅ⲗ̅.",
                "arabic": "هلليلويا هلليلويا، يسوع المسيح إبن الله، الذي صُلب على الصليب، إسحق الشيطان تحت أرجلنا، هلليلويا هلليلويا."
              }
            ]
          }
        ]
      }
    ]
  }
]
