[
  {
    "english_title": "Prayer For Repentance",
    "coptic_title": null,
    "arabic_title": "صلاة للتوبة",
    "title": "Prayer For Repentance",
    "tbodies": [
      {
        "rows": [
          {
            "row-class": "text",
            "cells": [
              {
                "english": "My Lord, God and Savior Jesus Christ, treasure of mercy and spring of salvation, I come to You confessing my sins. I confess that with boldness I dared to defile Your holy sanctuary with my sins. Now I seek Your mercy and love, for Your mercies are boundless; You never turn back a sinner who comes to You. I confess that my mind is burdened with sin and that I have no strength left. Do not turn away from me; do not rebuke me in Your anger nor chasten me in Your displeasure. I am worn out; have compassion upon me, O Lord. Do not judge me according to Your justice, but according to Your mercy. Remember Your creation; do not put me on trial, because none of Your servants can justify their deeds. Dress me in a new attire that befits Your glory. Forgive my sins and I shall sing, “Blessed is he whose sins are forgiven.” When I confess my sins and reveal my iniquities, You cleanse me. Amen.",
                "arabic": "ربي وإلهي ومخلصي يسوع المسيح، كنز الرحمة ونبع الخلاص، آتي إليك مقراً بذنوبي. اعترف بأني بوقاحة تجاسرت ودنست هيكلك المقدس بخطاياي. والآن ألجأ إلى رحمتك وتحننك، لأن مراحمك لا تُحصى، وأنك لا ترد خاطئاً قد أقبل إليك. فها أنا آتي يارب معترفاً بأن آثامي قد طمت فوق رأسي كحمل ثقيل، و قد فارقتني قوتي. فلا تحجب يارب وجهك عني لئلا أرتاع. ولا توبخني بغضبك. ولا تودبني بغيظك. ولا تحاكمني بحسب استحقاقي. ارحمني يارب فإني ضعيف. اذكر يارب أني عمل يديك وارأف بي. لا تدخل فى المحاكمة مع عبدك، لأنه لن يتبرر قدامك أي حي. عد وألبسني حلة جديدة تليق بمجدك. اغفر لي وسامحني، لأترنم قائلاً: طوبى لمن غفر إثمه، وسترت خطيته. اعترف لك بخطيتى، ولا أكتم إثمي. قلت اعترف للرب بذنبي. وأنك رفعت آثام خطيتي. آمين."
              }
            ]
          }
        ]
      }
    ]
  },
  {
    "english_title": "Prayer Before Confession",
    "coptic_title": null,
    "arabic_title": "صلاة قبل الإعتراف",
    "title": "Prayer Before Confession",
    "tbodies": [
      {
        "rows": [
          {
            "row-class": "text",
            "cells": [
              {
                "english": "O Holy Father, who desires the repentance of sinners, promising to accept them back; look now, O Lord, at my sinful soul for I have erred and lost my way in the valleys of transgressions for many years, and I am embittered and wretched for being removed from the fountain of my salvation. Yet, now I come to You, asking to be cleansed from all defilement and filth. Do not reject, but accept me. Look at me with compassion and deal with me mercifully and I will be cleansed and saved; do not neglect me lest I perish. Grant me grace that I may approach You with faith and hope, to confess my trespasses and my sins. Enlighten my heart that I may realize my sins, my mistakes and my straying. Grant me determination to forsake evil that I may be established in Your commandments and live for the glory of Your holy name. Amen.",
                "arabic": "أيها الآب القدوس، الذي يحب رجوع الخطاة. وقد وعدت أنك مستعد لقبولهم. انظر يارب الآن إلى نفس خاطئة قد ضلَّت وتاهت في أودية العصيان زماناً طويلاً. فيه تمررت وشعرت بشقاوتها، لبعدها عن ينبوع خلاصها. الآن تتقدم إليك، تطلب منك تطهيرها من الأدناس والأقذار التي توحلت فيها. اقبلها ولا ترفضها فإنك إن نظرت إليها بحنوك، وعاملتها برحمتك تنقت وخلصت، وإن أهملتها، بادَت وهلكت. امنحني يارب نعمة بها أتقوى على الدنو منك بإيمان وطيد ورجاء تام، لأعترف بذنوبي وأكره العودة إليها. وليبكتني روحك على آثامي. أنر قلبي لأرى كم أخطأت، وأسأت، وتركت، وأهملت. وامنحني عزماً على عدم الرجوع إلى الإثم لأثبت في حفظ وصاياك وأحيا لمجد اسمك القدوس، آمين."
              }
            ]
          }
        ]
      }
    ]
  },
  {
    "english_title": "Prayer after Confession",
    "coptic_title": null,
    "arabic_title": "صلاة بعد الإعتراف",
    "title": "Prayer after Confession",
    "tbodies": [
      {
        "rows": [
          {
            "row-class": "text",
            "cells": [
              {
                "english": "I thank Your goodness, O Lover of Mankind because You did not desire that I perish, but have awakened me from my slumber and guided me to Your path. You saved me from the valley of destruction, and brought me to the safety of Your bosom. Fill me with hope and faith, for I have come to You as the sick one to his physician, and as the hungry to the Spring of living water, as the poor to the Source of riches, as the sinners to the Savior, and as the dead to the Fountain of Life; for You are my salvation, my healer, my life, my strength, my comfort, my joy, and my rest is in you. Help me, protect me, and teach me to put my will in Your hands, that I may live according to Your will. Remove my weakness that I may be firm and continue to be faithful to You until the end. Amen.",
                "arabic": "أشكر صلاحك أيها الآب محب البشر لأنك لم تشأ هلاكي. بل أيقظتني من غفلتي، وهديتني إلى طريقك. ورددتني من وادي الهلاك إلى حمى حصنك الأمين. فاملأني بالرجاء والإيمان. أقبلت إليك يا رب كالمريض إلى الطبيب الشافي، وكالمفتقر الجائع إلى الغذاء المشبع، وكالعطشان إلى ينابيع المياه الحية، وكالفقير إلى مصدر الغنى، وكالخاطىء إلى المخلص، وكالمائت إلى ينبوع الحياة. لأنك خلاصي، وطبيبي، وحياتي، وقوتي، وتعزيتي، وسعادتي، وفيك راحتي. فأعنّي واحفظني وسيِّج حولي، وعلِّمني أن أضع بين يديك كل إرادتي، لأسير حسب ما تشاء. أعن ضعفي كي أثبت وأدوم أميناً لك إلى النهاية، آمين."
              }
            ]
          }
        ]
      }
    ]
  }
]
